<?xml version="1.0" encoding="UTF-8"?>
<SPECIALS xmlns:xsi="http://www.w3.org/2001/XMLSchema-instance"
 xsi:noNamespaceSchemaLocation="file:/D:/Projects/BaiTapXML/chuong4-bai8/QLDia.xsd">
    <TITLE>TITLE0</TITLE>
    <MESSAGE>MESSAGE0</MESSAGE>
    <CD>
        <ARTIST>ARTIST0</ARTIST>
        <PRICEUS>0</PRICEUS>
        <PRICEVN>0</PRICEVN>
        <TRACK length="50"/>
        <TRACK length="50"/>
    </CD>
    <CD>
        <ARTIST>ARTIST1</ARTIST>
        <PRICEUS>0</PRICEUS>
        <PRICEVN>0</PRICEVN>
        <TRACK length="50"/>
        <TRACK length="50"/>
    </CD>
</SPECIALS>
